0	1800	&#0;		<control>	Common	Cc	Latin	Latn	Basic Latin
174	20782	&reg;	®	Registered Sign	Common	So	Latin	Latn	Latin-1 Supplement
232	105035	&egrave;	è	Latin Small Letter E With Grave	Latin	L&	Latin	Latn	Latin-1 Supplement
290	29	&#290;	Ģ	Latin Capital Letter G With Cedilla	Latin	L&	Latin	Latn	Latin Extended-A
348	14	&#348;	Ŝ	Latin Capital Letter S With Circumflex	Latin	L&	Latin	Latn	Latin Extended-A
406	3	&#406;	Ɩ	Latin Capital Letter Iota	Latin	L&	Latin	Latn	Latin Extended-B
464	61	&#464;	ǐ	Latin Small Letter I With Caron	Latin	L&	Latin	Latn	Latin Extended-B
580	1	&#580;	Ʉ	Latin Capital Letter U Bar	Latin	L&	Latin	Latn	Latin Extended-B
638	181	&#638;	ɾ	Latin Small Letter R With Fishhook	Latin	L&	(Phonetic)	_ipa	IPA Extensions
696	1	&#696;	ʸ	Modifier Letter Small Y	Latin	Lm	(Symbols)	_sym	Spacing Modifier Letters
812	16	&#812;	̬	Combining Caron Below	Inherited	Mn	(Diacriticals)	_dia	Combining Diacritical Marks
870	2	&#870;	ͦ	Combining Latin Small Letter O	Inherited	Mn	(Diacriticals)	_dia	Combining Diacritical Marks
928	8444	&Pi;	Π	Greek Capital Letter Pi	Greek	L&	Greek	Grek	Greek and Coptic
986	1	&#986;	Ϛ	Greek Letter Stigma	Greek	L&	Greek	Grek	Greek and Coptic
1044	30605	&#1044;	Д	Cyrillic Capital Letter De	Cyrillic	L&	Cyrillic	Cyrl	Cyrillic
1102	52098	&#1102;	ю	Cyrillic Small Letter Yu	Cyrillic	L&	Cyrillic	Cyrl	Cyrillic
1160	46	&#1160;	҈	Combining Cyrillic Hundred Thousands Sign	Cyrillic	Me	Cyrillic	Cyrl	Cyrillic
1218	4	&#1218;	ӂ	Cyrillic Small Letter Zhe With Breve	Cyrillic	L&	Cyrillic	Cyrl	Cyrillic
1276	3	&#1276;	Ӽ	Cyrillic Capital Letter Ha With Hook	Cyrillic	L&	Cyrillic	Cyrl	Cyrillic
1334	4	&#1334;	Զ	Armenian Capital Letter Za	Armenian	L&	Armenian	Armn	Armenian
1392	3	&#1392;	հ	Armenian Small Letter Ho	Armenian	L&	Armenian	Armn	Armenian
1450	6	&#1450;	֪	Hebrew Accent Yerah Ben Yomo	Hebrew	Mn	Hebrew	Hebr	Hebrew
1508	17899	&#1508;	פ	Hebrew Letter Pe	Hebrew	Lo	Hebrew	Hebr	Hebrew
1624	1	&#1624;	٘	Arabic Mark Noon Ghunna	Arabic	Mn	Arabic	Arab	Arabic
1682	1	&#1682;	ڒ	Arabic Letter Reh With Small V	Arabic	Lo	Arabic	Arab	Arabic
1740	437936	&#1740;	ی	Arabic Letter Farsi Yeh	Arabic	Lo	Arabic	Arab	Arabic
2320	53	&#2320;	ऐ	Devanagari Letter Ai	Devanagari	Lo	Devanagari	Deva	Devanagari
2378	4	&#2378;	ॊ	Devanagari Vowel Sign Short O	Devanagari	Mc	Devanagari	Deva	Devanagari
2494	556	&#2494;	া	Bengali Vowel Sign Aa	Bengali	Mc	Bengali	Beng	Bengali
2610	27	&#2610;	ਲ	Gurmukhi Letter La	Gurmukhi	Lo	Gurmukhi	Guru	Gurmukhi
2726	9	&#2726;	દ	Gujarati Letter Da	Gujarati	Lo	Gujarati	Gujr	Gujarati
2958	4491	&#2958;	எ	Tamil Letter E	Tamil	Lo	Tamil	Taml	Tamil
3016	12478	&#3016;	ை	Tamil Vowel Sign Ai	Tamil	Mc	Tamil	Taml	Tamil
3074	1345	&#3074;	ం	Telugu Sign Anusvara	Telugu	Mc	Telugu	Telu	Telugu
3248	1934	&#3248;	ರ	Kannada Letter Ra	Kannada	Lo	Kannada	Knda	Kannada
3306	1	&#3306;	೪	Kannada Digit Four	Kannada	Nd	Kannada	Knda	Kannada
3364	1170	&#3364;	ത	Malayalam Letter Ta	Malayalam	Lo	Malayalam	Mlym	Malayalam
3538	458	&#3538;	ි	Sinhala Vowel Sign Ketti Is-pilla	Sinhala	Mn	Sinhala	Sinh	Sinhala
3596	45	&#3596;	ฌ	Thai Character Cho Choe	Thai	Lo	Thai	Thai	Thai
3654	27746	&#3654;	ๆ	Thai Character Maiyamok	Thai	Lm	Thai	Thai	Thai
3944	1	&#3944;	ཨ	Tibetan Letter A	Tibetan	Lo	Tibetan	Tibt	Tibetan
4118	420	&#4118;	ဖ	Myanmar Letter Pha	Myanmar	Lo	Myanmar	Mymr	Burmese (Myanmar)
4234	40	&#4234;	ႊ	Myanmar Sign Shan Tone-6	Myanmar	Mc	Myanmar	Mymr	Burmese (Myanmar)
4292	1	&#4292;	Ⴤ	Georgian Capital Letter Har	Georgian	L&	Georgian	Geor	Georgian
4466	1	&#4466;	ᅲ	Hangul Jungseong Yu	Hangul	Lo	Korean	Kore	Hangul Jamo
4814	1	&#4814;	ዎ	Ethiopic Syllable Wo	Ethiopic	Lo	Ethiopic	Ethi	Ethiopic
4872	3	&#4872;	ገ	Ethiopic Syllable Ga	Ethiopic	Lo	Ethiopic	Ethi	Ethiopic
5800	1	&#5800;	ᚨ	Runic Letter Ansuz A	Runic	Lo	Runic	Runr	Runic
6032	243	&#6032;	ថ	Khmer Letter Tha	Khmer	Lo	Khmer	Khmr	Khmer
6090	104	&#6090;	៊	Khmer Sign Triisap	Khmer	Mn	Khmer	Khmr	Khmer
7424	1	&#7424;	ᴀ	Latin Letter Small Capital A	Latin	L&	(Phonetic)	_ipa	Phonetic Extensions
7482	1	&#7482;	ᴺ	Modifier Letter Capital N	Latin	Lm	(Phonetic)	_ipa	Phonetic Extensions
7714	1	&#7714;	Ḣ	Latin Capital Letter H With Dot Above	Latin	L&	Latin	Latn	Latin Extended Additional
7888	22	&#7888;	Ố	Latin Capital Letter O With Circumflex And Acute	Latin	L&	Latin	Latn	Latin Extended Additional
8004	4	&#8004;	ὄ	Greek Small Letter Omicron With Psili And Oxia	Greek	L&	Greek	Grek	Greek Extended
8236	726	&#8236;	‬	Pop Directional Formatting	Common	Cf	(Symbols)	_sym	General Punctuation
8352	3	&#8352;	₠	Euro-currency Sign	Common	Sc	(Symbols)	_sym	Currency Symbols
8410	6	&#8410;	⃚	Combining Anticlockwise Ring Overlay	Inherited	Mn	(Symbols)	_sym	Combining Diacritical Marks for Symbols
8468	1	&#8468;	℔	L B Bar Symbol	Common	So	(Symbols)	_sym	Letterlike Symbols
8642	2	&#8642;	⇂	Downwards Harpoon With Barb Rightwards	Common	So	(Drawing)	_drw	Arrows
8758	37	&#8758;	∶	Ratio	Common	Sm	(Mathematical)	_mth	Mathematical Operators
9222	2	&#9222;	␆	Symbol For Acknowledge	Common	So	(Symbols)	_sym	Control Pictures
9570	2	&#9570;	╢	Box Drawings Vertical Double And Left Single	Common	So	(Drawing)	_drw	Box Drawing
9628	10	&#9628;	▜	Quadrant Upper Left And Upper Right And Lower Right	Common	So	(Drawing)	_drw	Block Elements
9744	64	&#9744;	☐	Ballot Box	Common	So	(Mathematical)	_mth	Miscellaneous Symbols
9802	11	&#9802;	♊	Gemini	Common	So	(Mathematical)	_mth	Miscellaneous Symbols
9860	3	&#9860;	⚄	Die Face-5	Common	So	(Mathematical)	_mth	Miscellaneous Symbols
10034	21	&#10034;	✲	Open Centre Asterisk	Common	So	(Symbols)	_sym	Dingbats
10150	2	&#10150;	➦	Heavy Black Curved Upwards And Rightwards Arrow	Common	So	(Symbols)	_sym	Dingbats
10382	1	&#10382;	⢎	Braille Pattern Dots-2348	Braille	So	(Braille)	_brl	Braille Patterns
10498	1	&#10498;	⤂	Leftwards Double Arrow With Vertical Stroke	Common	Sm	(Drawing)	_drw	Supplemental Arrows-B
10556	1	&#10556;	⤼	Top Arc Clockwise Arrow With Minus	Common	Sm	(Drawing)	_drw	Supplemental Arrows-B
10614	1	&#10614;	⥶	Less-than Above Leftwards Arrow	Common	Sm	(Drawing)	_drw	Supplemental Arrows-B
12296	3210	&#12296;	〈	Left Angle Bracket	Common	Ps	CJK	_cjk	CJK Symbols and Punctuation
12354	1823024	&#12354;	あ	Hiragana Letter A	Hiragana	Lo	Hiragana	_hir	Hiragana
12412	119009	&#12412;	ぼ	Hiragana Letter Bo	Hiragana	Lo	Hiragana	_hir	Hiragana
12470	101578	&#12470;	ザ	Katakana Letter Za	Katakana	Lo	Katakana	Kana	Katakana
12528	411	&#12528;	ヰ	Katakana Letter Wi	Katakana	Lo	Katakana	Kana	Katakana
12934	1	&#12934;	㊆	Circled Ideograph Seven	Common	No	CJK	_cjk	Enclosed CJK Letters and Months
13050	7	&#13050;	㋺	Circled Katakana Ro	Katakana	So	CJK	_cjk	Enclosed CJK Letters and Months
13108	3	&#13108;	㌴	Square Bussyeru	Katakana	So	CJK	_cjk	CJK Compatibility
13166	2	&#13166;	㍮	Ideographic Telegraph Symbol For Hour Twenty-two	Common	So	CJK	_cjk	CJK Compatibility
41122	1	&#41122;	ꂢ	Yi Syllable Hmop	Yi	Lo	Yi	Yiii	Yi Syllables
41702	1	&#41702;	ꋦ	Yi Syllable Zzur	Yi	Lo	Yi	Yiii	Yi Syllables
64380	172	&#64380;	ﭼ	Arabic Letter Tcheh Initial Form	Arabic	Lo	Arabic	Arab	Arabic Presentation Forms-A
65018	1	&#65018;	ﷺ	Arabic Ligature Sallallahou Alayhe Wasallam	Arabic	Lo	Arabic	Arab	Arabic Presentation Forms-A
65076	20	&#65076;	︴	Presentation Form For Vertical Wavy Low Line	Common	Pc	CJK	_cjk	CJK Compatibility Forms
65192	39	&#65192;	ﺨ	Arabic Letter Khah Medial Form	Arabic	Lo	Arabic	Arab	Arabic Presentation Forms-B
65250	40	&#65250;	ﻢ	Arabic Letter Meem Final Form	Arabic	Lo	Arabic	Arab	Arabic Presentation Forms-B
65308	104958	&#65308;	＜	Fullwidth Less-than Sign	Common	Sm	(Miscellaneous)	_msc	Halfwidth and Fullwidth Forms
65366	4119	&#65366;	ｖ	Fullwidth Latin Small Letter V	Latin	L&	(Miscellaneous)	_msc	Halfwidth and Fullwidth Forms
65424	4233	&#65424;	ﾐ	Halfwidth Katakana Letter Mi	Katakana	Lo	(Miscellaneous)	_msc	Halfwidth and Fullwidth Forms
1	326	&#1;		<control>	Common	Cc	Latin	Latn	Basic Latin
175	10264	&macr;	¯	Macron	Common	Sk	Latin	Latn	Latin-1 Supplement
233	1011123	&eacute;	é	Latin Small Letter E With Acute	Latin	L&	Latin	Latn	Latin-1 Supplement
291	606	&#291;	ģ	Latin Small Letter G With Cedilla	Latin	L&	Latin	Latn	Latin Extended-A
349	112	&#349;	ŝ	Latin Small Letter S With Circumflex	Latin	L&	Latin	Latn	Latin Extended-A
407	30	&#407;	Ɨ	Latin Capital Letter I With Stroke	Latin	L&	Latin	Latn	Latin Extended-B
465	1	&#465;	Ǒ	Latin Capital Letter O With Caron	Latin	L&	Latin	Latn	Latin Extended-B
523	1	&#523;	ȋ	Latin Small Letter I With Inverted Breve	Latin	L&	Latin	Latn	Latin Extended-B
581	1	&#581;	Ʌ	Latin Capital Letter Turned V	Latin	L&	Latin	Latn	Latin Extended-B
639	14	&#639;	ɿ	Latin Small Letter Reversed R With Fishhook	Latin	L&	(Phonetic)	_ipa	IPA Extensions
697	3	&#697;	ʹ	Modifier Letter Prime	Common	Lm	(Symbols)	_sym	Spacing Modifier Letters
755	33	&#755;	˳	Modifier Letter Low Ring	Common	Sk	(Symbols)	_sym	Spacing Modifier Letters
871	1	&#871;	ͧ	Combining Latin Small Letter U	Inherited	Mn	(Diacriticals)	_dia	Combining Diacritical Marks
929	2239	&Rho;	Ρ	Greek Capital Letter Rho	Greek	L&	Greek	Grek	Greek and Coptic
987	1	&#987;	ϛ	Greek Small Letter Stigma	Greek	L&	Greek	Grek	Greek and Coptic
1045	6291	&#1045;	Е	Cyrillic Capital Letter Ie	Cyrillic	L&	Cyrillic	Cyrl	Cyrillic
1103	139451	&#1103;	я	Cyrillic Small Letter Ya	Cyrillic	L&	Cyrillic	Cyrl	Cyrillic
1161	118	&#1161;	҉	Combining Cyrillic Millions Sign	Cyrillic	Me	Cyrillic	Cyrl	Cyrillic
1277	1	&#1277;	ӽ	Cyrillic Small Letter Ha With Hook	Cyrillic	L&	Cyrillic	Cyrl	Cyrillic
1335	3	&#1335;	Է	Armenian Capital Letter Eh	Armenian	L&	Armenian	Armn	Armenian
1393	6	&#1393;	ձ	Armenian Small Letter Ja	Armenian	L&	Armenian	Armn	Armenian
1451	1	&#1451;	֫	Hebrew Accent Ole	Hebrew	Mn	Hebrew	Hebr	Hebrew
1509	1619	&#1509;	ץ	Hebrew Letter Final Tsadi	Hebrew	Lo	Hebrew	Hebr	Hebrew
1567	16218	&#1567;	؟	Arabic Question Mark	Common	Po	Arabic	Arab	Arabic
1625	1	&#1625;	ٙ	Arabic Zwarakay	Arabic	Mn	Arabic	Arab	Arabic
1683	89	&#1683;	ړ	Arabic Letter Reh With Ring	Arabic	Lo	Arabic	Arab	Arabic
1741	40	&#1741;	ۍ	Arabic Letter Yeh With Tail	Arabic	Lo	Arabic	Arab	Arabic
1857	1	&#1857;	݁	Syriac Qushshaya	Syriac	Mn	Syriac	Syrc	Syriac
1915	1	&#1915;	ݻ	Arabic Letter Yeh Barree With Extended Arabic-indic Digit Three Above	Arabic	Lo	Arabic	Arab	Arabic Supplement
2321	82	&#2321;	ऑ	Devanagari Letter Candra O	Devanagari	Lo	Devanagari	Deva	Devanagari
2379	4438	&#2379;	ो	Devanagari Vowel Sign O	Devanagari	Mc	Devanagari	Deva	Devanagari
2437	15	&#2437;	অ	Bengali Letter A	Bengali	Lo	Bengali	Beng	Bengali
2495	241	&#2495;	ি	Bengali Vowel Sign I	Bengali	Mc	Bengali	Beng	Bengali
2553	1	&#2553;	৹	Bengali Currency Denominator Sixteen	Bengali	No	Bengali	Beng	Bengali
2727	4	&#2727;	ધ	Gujarati Letter Dha	Gujarati	Lo	Gujarati	Gujr	Gujarati
2959	589	&#2959;	ஏ	Tamil Letter Ee	Tamil	Lo	Tamil	Taml	Tamil
3075	1	&#3075;	ః	Telugu Sign Visarga	Telugu	Mc	Telugu	Telu	Telugu
3307	1	&#3307;	೫	Kannada Digit Five	Kannada	Nd	Kannada	Knda	Kannada
3365	41	&#3365;	ഥ	Malayalam Letter Tha	Malayalam	Lo	Malayalam	Mlym	Malayalam
3539	48	&#3539;	ී	Sinhala Vowel Sign Diga Is-pilla	Sinhala	Mn	Sinhala	Sinh	Sinhala
3597	9758	&#3597;	ญ	Thai Character Yo Ying	Thai	Lo	Thai	Thai	Thai
3655	43932	&#3655;	็	Thai Character Maitaikhu	Thai	Mn	Thai	Thai	Thai
3713	1355	&#3713;	ກ	Lao Letter Ko	Lao	Lo	Lao	Laoo	Lao
3771	734	&#3771;	ົ	Lao Vowel Sign Mai Kon	Lao	Mn	Lao	Laoo	Lao
3887	2	&#3887;	༯	Tibetan Digit Half Six	Tibetan	No	Tibetan	Tibt	Tibetan
4119	86	&#4119;	ဗ	Myanmar Letter Ba	Myanmar	Lo	Myanmar	Mymr	Burmese (Myanmar)
4757	12	&#4757;	ን	Ethiopic Syllable Ne	Ethiopic	Lo	Ethiopic	Ethi	Ethiopic
5221	1	&#5221;	ᑥ	Canadian Syllabics Naskapi Twaa	Canadian_Aboriginal	Lo	Unified Canadian Aboriginal Syllabics	Cans	Unified Canadian Aboriginal Syllabics
5337	1	&#5337;	ᓙ	Canadian Syllabics Y-cree Loo	Canadian_Aboriginal	Lo	Unified Canadian Aboriginal Syllabics	Cans	Unified Canadian Aboriginal Syllabics
5395	1	&#5395;	ᔓ	Canadian Syllabics Sho	Canadian_Aboriginal	Lo	Unified Canadian Aboriginal Syllabics	Cans	Unified Canadian Aboriginal Syllabics
5511	1	&#5511;	ᖇ	Canadian Syllabics Tlhi	Canadian_Aboriginal	Lo	Unified Canadian Aboriginal Syllabics	Cans	Unified Canadian Aboriginal Syllabics
6033	445	&#6033;	ទ	Khmer Letter To	Khmer	Lo	Khmer	Khmr	Khmer
6091	507	&#6091;	់	Khmer Sign Bantoc	Khmer	Mn	Khmer	Khmr	Khmer
7483	2	&#7483;	ᴻ	Modifier Letter Capital Reversed N	Latin	Lm	(Phonetic)	_ipa	Phonetic Extensions
7831	2	&#7831;	ẗ	Latin Small Letter T With Diaeresis	Latin	L&	Latin	Latn	Latin Extended Additional
7889	2439	&#7889;	ố	Latin Small Letter O With Circumflex And Acute	Latin	L&	Latin	Latn	Latin Extended Additional
8005	5	&#8005;	ὅ	Greek Small Letter Omicron With Dasia And Oxia	Greek	L&	Greek	Grek	Greek Extended
8179	9	&#8179;	ῳ	Greek Small Letter Omega With Ypogegrammeni	Greek	L&	Greek	Grek	Greek Extended
8237	118	&#8237;	‭	Left-to-right Override	Common	Cf	(Symbols)	_sym	General Punctuation
8353	52	&#8353;	₡	Colon Sign	Common	Sc	(Symbols)	_sym	Currency Symbols
8469	11	&#8469;	ℕ	Double-struck Capital N	Common	L&	(Symbols)	_sym	Letterlike Symbols
8759	2	&#8759;	∷	Proportion	Common	Sm	(Mathematical)	_mth	Mathematical Operators
9223	3	&#9223;	␇	Symbol For Bell	Common	So	(Symbols)	_sym	Control Pictures
9281	1	&#9281;	⑁	Ocr Chair	Common	So	(Symbols)	_sym	Optical Character Recognition
9339	1	&#9339;	⑻	Parenthesized Digit Eight	Common	No	Latin	Latn	Enclosed Alphanumerics
9571	117	&#9571;	╣	Box Drawings Double Vertical And Left	Common	So	(Drawing)	_drw	Box Drawing
9629	6	&#9629;	▝	Quadrant Upper Right	Common	So	(Drawing)	_drw	Block Elements
9745	718	&#9745;	☑	Ballot Box With Check	Common	So	(Mathematical)	_mth	Miscellaneous Symbols
9803	39	&#9803;	♋	Cancer	Common	So	(Mathematical)	_mth	Miscellaneous Symbols
9861	4	&#9861;	⚅	Die Face-6	Common	So	(Mathematical)	_mth	Miscellaneous Symbols
10035	27	&#10035;	✳	Eight Spoked Asterisk	Common	So	(Symbols)	_sym	Dingbats
10151	4	&#10151;	➧	Squat Black Rightwards Arrow	Common	So	(Symbols)	_sym	Dingbats
10267	6	&#10267;	⠛	Braille Pattern Dots-1245	Braille	So	(Braille)	_brl	Braille Patterns
10499	1	&#10499;	⤃	Rightwards Double Arrow With Vertical Stroke	Common	Sm	(Drawing)	_drw	Supplemental Arrows-B
10557	1	&#10557;	⤽	Top Arc Anticlockwise Arrow With Plus	Common	Sm	(Drawing)	_drw	Supplemental Arrows-B
10615	1	&#10615;	⥷	Leftwards Arrow Through Less-than	Common	Sm	(Drawing)	_drw	Supplemental Arrows-B
12297	3235	&#12297;	〉	Right Angle Bracket	Common	Pe	CJK	_cjk	CJK Symbols and Punctuation
12355	35734	&#12355;	ぃ	Hiragana Letter Small I	Hiragana	Lo	Hiragana	_hir	Hiragana
12413	98246	&#12413;	ぽ	Hiragana Letter Po	Hiragana	Lo	Hiragana	_hir	Hiragana
12471	440134	&#12471;	シ	Katakana Letter Si	Katakana	Lo	Katakana	Kana	Katakana
12529	569	&#12529;	ヱ	Katakana Letter We	Katakana	Lo	Katakana	Kana	Katakana
12703	1	&#12703;	㆟	Ideographic Annotation Man Mark	Common	So	(Kanbun)	_kbn	Kanbun
12993	1	&#12993;	㋁	Ideographic Telegraph Symbol For February	Common	So	CJK	_cjk	Enclosed CJK Letters and Months
13051	1	&#13051;	㋻	Circled Katakana Wa	Katakana	So	CJK	_cjk	Enclosed CJK Letters and Months
13109	4	&#13109;	㌵	Square Huran	Katakana	So	CJK	_cjk	CJK Compatibility
13167	1	&#13167;	㍯	Ideographic Telegraph Symbol For Hour Twenty-three	Common	So	CJK	_cjk	CJK Compatibility
13225	1	&#13225;	㎩	Square Pa	Common	So	CJK	_cjk	CJK Compatibility
41123	1	&#41123;	ꂣ	Yi Syllable Hmut	Yi	Lo	Yi	Yiii	Yi Syllables
41645	1	&#41645;	ꊭ	Yi Syllable Zyr	Yi	Lo	Yi	Yiii	Yi Syllables
41935	1	&#41935;	ꏏ	Yi Syllable Ro	Yi	Lo	Yi	Yiii	Yi Syllables
63743	2864	&#63743;		<private Use, Last>			_prv	Private Use Area
64381	152	&#64381;	ﭽ	Arabic Letter Tcheh Medial Form	Arabic	Lo	Arabic	Arab	Arabic Presentation Forms-A
65077	24	&#65077;	︵	Presentation Form For Vertical Left Parenthesis	Common	Ps	CJK	_cjk	CJK Compatibility Forms
65193	546	&#65193;	ﺩ	Arabic Letter Dal Isolated Form	Arabic	Lo	Arabic	Arab	Arabic Presentation Forms-B
65251	868	&#65251;	ﻣ	Arabic Letter Meem Initial Form	Arabic	Lo	Arabic	Arab	Arabic Presentation Forms-B
65309	25898	&#65309;	＝	Fullwidth Equals Sign	Common	Sm	(Miscellaneous)	_msc	Halfwidth and Fullwidth Forms
65367	705118	&#65367;	ｗ	Fullwidth Latin Small Letter W	Latin	L&	(Miscellaneous)	_msc	Halfwidth and Fullwidth Forms
65425	2716	&#65425;	ﾑ	Halfwidth Katakana Letter Mu	Katakana	Lo	(Miscellaneous)	_msc	Halfwidth and Fullwidth Forms
2	1354	&#2;		<control>	Common	Cc	Latin	Latn	Basic Latin
176	40427	&deg;	°	Degree Sign	Common	So	Latin	Latn	Latin-1 Supplement
234	120277	&ecirc;	ê	Latin Small Letter E With Circumflex	Latin	L&	Latin	Latn	Latin-1 Supplement
292	6	&#292;	Ĥ	Latin Capital Letter H With Circumflex	Latin	L&	Latin	Latn	Latin Extended-A
350	1903	&#350;	Ş	Latin Capital Letter S With Cedilla	Latin	L&	Latin	Latn	Latin Extended-A
466	60	&#466;	ǒ	Latin Small Letter O With Caron	Latin	L&	Latin	Latn	Latin Extended-B
524	3	&#524;	Ȍ	Latin Capital Letter O With Double Grave	Latin	L&	Latin	Latn	Latin Extended-B
582	1	&#582;	Ɇ	Latin Capital Letter E With Stroke	Latin	L&	Latin	Latn	Latin Extended-B
640	17	&#640;	ʀ	Latin Letter Small Capital R	Latin	L&	(Phonetic)	_ipa	IPA Extensions
814	304	&#814;	̮	Combining Breve Below	Inherited	Mn	(Diacriticals)	_dia	Combining Diacritical Marks
872	5	&#872;	ͨ	Combining Latin Small Letter C	Inherited	Mn	(Diacriticals)	_dia	Combining Diacritical Marks
1046	2392	&#1046;	Ж	Cyrillic Capital Letter Zhe	Cyrillic	L&	Cyrillic	Cyrl	Cyrillic
1104	9	&#1104;	ѐ	Cyrillic Small Letter Ie With Grave	Cyrillic	L&	Cyrillic	Cyrl	Cyrillic
1278	5	&#1278;	Ӿ	Cyrillic Capital Letter Ha With Stroke	Cyrillic	L&	Cyrillic	Cyrl	Cyrillic
1394	6	&#1394;	ղ	Armenian Small Letter Ghad	Armenian	L&	Armenian	Armn	Armenian
1510	11019	&#1510;	צ	Hebrew Letter Tsadi	Hebrew	Lo	Hebrew	Hebr	Hebrew
1626	1	&#1626;	ٚ	Arabic Vowel Sign Small V Above	Arabic	Mn	Arabic	Arab	Arabic
1858	59	&#1858;	݂	Syriac Rukkakha	Syriac	Mn	Syriac	Syrc	Syriac
2322	3	&#2322;	ऒ	Devanagari Letter Short O	Devanagari	Lo	Devanagari	Deva	Devanagari
2380	378	&#2380;	ौ	Devanagari Vowel Sign Au	Devanagari	Mc	Devanagari	Deva	Devanagari
2438	64	&#2438;	আ	Bengali Letter Aa	Bengali	Lo	Bengali	Beng	Bengali
2496	40	&#2496;	ী	Bengali Vowel Sign Ii	Bengali	Mc	Bengali	Beng	Bengali
2728	29	&#2728;	ન	Gujarati Letter Na	Gujarati	Lo	Gujarati	Gujr	Gujarati
2960	268	&#2960;	ஐ	Tamil Letter Ai	Tamil	Lo	Tamil	Taml	Tamil
3018	3652	&#3018;	ொ	Tamil Vowel Sign O	Tamil	Mc	Tamil	Taml	Tamil
3134	2187	&#3134;	ా	Telugu Vowel Sign Aa	Telugu	Mn	Telugu	Telu	Telugu
3250	998	&#3250;	ಲ	Kannada Letter La	Kannada	Lo	Kannada	Knda	Kannada
3308	1	&#3308;	೬	Kannada Digit Six	Kannada	Nd	Kannada	Knda	Kannada
3366	225	&#3366;	ദ	Malayalam Letter Da	Malayalam	Lo	Malayalam	Mlym	Malayalam
3424	4	&#3424;	ൠ	Malayalam Letter Vocalic Rr	Malayalam	Lo	Malayalam	Mlym	Malayalam
3482	316	&#3482;	ක	Sinhala Letter Alpapraana Kayanna	Sinhala	Lo	Sinhala	Sinh	Sinhala
3540	204	&#3540;	ු	Sinhala Vowel Sign Ketti Paa-pilla	Sinhala	Mn	Sinhala	Sinh	Sinhala
3598	608	&#3598;	ฎ	Thai Character Do Chada	Thai	Lo	Thai	Thai	Thai
3656	257252	&#3656;	่	Thai Character Mai Ek	Thai	Mn	Thai	Thai	Thai
3714	360	&#3714;	ຂ	Lao Letter Kho Sung	Lao	Lo	Lao	Laoo	Lao
3772	93	&#3772;	ຼ	Lao Semivowel Sign Lo	Lao	Mn	Lao	Laoo	Lao
4120	367	&#4120;	ဘ	Myanmar Letter Bha	Myanmar	Lo	Myanmar	Mymr	Burmese (Myanmar)
4236	2	&#4236;	ႌ	Myanmar Sign Shan Council Tone-3	Myanmar	Mc	Myanmar	Mymr	Burmese (Myanmar)
4352	3	&#4352;	ᄀ	Hangul Choseong Kiyeok	Hangul	Lo	Korean	Kore	Hangul Jamo
4758	1	&#4758;	ኖ	Ethiopic Syllable No	Ethiopic	Lo	Ethiopic	Ethi	Ethiopic
5222	1	&#5222;	ᑦ	Canadian Syllabics T	Canadian_Aboriginal	Lo	Unified Canadian Aboriginal Syllabics	Cans	Unified Canadian Aboriginal Syllabics
5338	1	&#5338;	ᓚ	Canadian Syllabics La	Canadian_Aboriginal	Lo	Unified Canadian Aboriginal Syllabics	Cans	Unified Canadian Aboriginal Syllabics
6034	216	&#6034;	ធ	Khmer Letter Tho	Khmer	Lo	Khmer	Khmr	Khmer
6092	33	&#6092;	៌	Khmer Sign Robat	Khmer	Mn	Khmer	Khmr	Khmer
7426	1	&#7426;	ᴂ	Latin Small Letter Turned Ae	Latin	L&	(Phonetic)	_ipa	Phonetic Extensions
7484	1	&#7484;	ᴼ	Modifier Letter Capital O	Latin	Lm	(Phonetic)	_ipa	Phonetic Extensions
7716	12	&#7716;	Ḥ	Latin Capital Letter H With Dot Below	Latin	L&	Latin	Latn	Latin Extended Additional
7774	1	&#7774;	Ṟ	Latin Capital Letter R With Line Below	Latin	L&	Latin	Latn	Latin Extended Additional
7890	17	&#7890;	Ồ	Latin Capital Letter O With Circumflex And Grave	Latin	L&	Latin	Latn	Latin Extended Additional
7948	2	&#7948;	Ἄ	Greek Capital Letter Alpha With Psili And Oxia	Greek	L&	Greek	Grek	Greek Extended
8238	148	&#8238;	‮	Right-to-left Override	Common	Cf	(Symbols)	_sym	General Punctuation
8354	3	&#8354;	₢	Cruzeiro Sign	Common	Sc	(Symbols)	_sym	Currency Symbols
8470	355	&#8470;	№	Numero Sign	Common	So	(Symbols)	_sym	Letterlike Symbols
8644	7	&#8644;	⇄	Rightwards Arrow Over Leftwards Arrow	Common	So	(Drawing)	_drw	Arrows
8992	2	&#8992;	⌠	Top Half Integral	Common	Sm	(Mathematical)	_mth	Miscellaneous Technical
9166	16	&#9166;	⏎	Return Symbol	Common	So	(Mathematical)	_mth	Miscellaneous Technical
9282	2	&#9282;	⑂	Ocr Fork	Common	So	(Symbols)	_sym	Optical Character Recognition
9398	57	&#9398;	Ⓐ	Circled Latin Capital Letter A	Common	So	Latin	Latn	Enclosed Alphanumerics
9572	7	&#9572;	╤	Box Drawings Down Single And Horizontal Double	Common	So	(Drawing)	_drw	Box Drawing
9630	4	&#9630;	▞	Quadrant Upper Right And Lower Left	Common	So	(Drawing)	_drw	Block Elements
9688	1219	&#9688;	◘	Inverse Bullet	Common	So	(Drawing)	_drw	Geometric Shapes
9746	143	&#9746;	☒	Ballot Box With X	Common	So	(Mathematical)	_mth	Miscellaneous Symbols
9804	23	&#9804;	♌	Leo	Common	So	(Mathematical)	_mth	Miscellaneous Symbols
9862	5	&#9862;	⚆	White Circle With Dot Right	Common	So	(Mathematical)	_mth	Miscellaneous Symbols
10036	21	&#10036;	✴	Eight Pointed Black Star	Common	So	(Symbols)	_sym	Dingbats
10152	11	&#10152;	➨	Heavy Concave-pointed Black Rightwards Arrow	Common	So	(Symbols)	_sym	Dingbats
10268	1	&#10268;	⠜	Braille Pattern Dots-345	Braille	So	(Braille)	_brl	Braille Patterns
10326	2	&#10326;	⡖	Braille Pattern Dots-2357	Braille	So	(Braille)	_brl	Braille Patterns
10500	1	&#10500;	⤄	Left Right Double Arrow With Vertical Stroke	Common	Sm	(Drawing)	_drw	Supplemental Arrows-B
10558	2	&#10558;	⤾	Lower Right Semicircular Clockwise Arrow	Common	Sm	(Drawing)	_drw	Supplemental Arrows-B
10616	1	&#10616;	⥸	Greater-than Above Rightwards Arrow	Common	Sm	(Drawing)	_drw	Supplemental Arrows-B
11776	14	&#11776;	⸀	Right Angle Substitution Marker	Common	Po	(Symbols)	_sym	Supplemental Punctuation
12298	28948	&#12298;	《	Left Double Angle Bracket	Common	Ps	CJK	_cjk	CJK Symbols and Punctuation
12356	7798261	&#12356;	い	Hiragana Letter I	Hiragana	Lo	Hiragana	_hir	Hiragana
12414	2267353	&#12414;	ま	Hiragana Letter Ma	Hiragana	Lo	Hiragana	_hir	Hiragana
12472	383066	&#12472;	ジ	Katakana Letter Zi	Katakana	Lo	Katakana	Kana	Katakana
12530	6663	&#12530;	ヲ	Katakana Letter Wo	Katakana	Lo	Katakana	Kana	Katakana
13052	2	&#13052;	㋼	Circled Katakana Wi	Katakana	So	CJK	_cjk	Enclosed CJK Letters and Months
13110	94	&#13110;	㌶	Square Hekutaaru	Katakana	So	CJK	_cjk	CJK Compatibility
13168	2	&#13168;	㍰	Ideographic Telegraph Symbol For Hour Twenty-four	Common	So	CJK	_cjk	CJK Compatibility
13226	1	&#13226;	㎪	Square Kpa	Common	So	CJK	_cjk	CJK Compatibility
41356	3	&#41356;	ꆌ	Yi Syllable No	Yi	Lo	Yi	Yiii	Yi Syllables
41472	1	&#41472;	ꈀ	Yi Syllable Kax	Yi	Lo	Yi	Yiii	Yi Syllables
42168	1	&#42168;	꒸	Yi Radical Wo	Yi	So	Yi	Yiii	Yi Radicals
63976	1	&#63976;	裡	CJK Compatibility Ideograph-f9e8	Han	Lo	CJK	_cjk	CJK Compatibility Ideographs
65020	2	&#65020;	﷼	Rial Sign	Arabic	Sc	Arabic	Arab	Arabic Presentation Forms-A
65078	29	&#65078;	︶	Presentation Form For Vertical Right Parenthesis	Common	Pe	CJK	_cjk	CJK Compatibility Forms
65194	757	&#65194;	ﺪ	Arabic Letter Dal Final Form	Arabic	Lo	Arabic	Arab	Arabic Presentation Forms-B
65252	275	&#65252;	ﻤ	Arabic Letter Meem Medial Form	Arabic	Lo	Arabic	Arab	Arabic Presentation Forms-B
65310	124873	&#65310;	＞	Fullwidth Greater-than Sign	Common	Sm	(Miscellaneous)	_msc	Halfwidth and Fullwidth Forms
65368	2428	&#65368;	ｘ	Fullwidth Latin Small Letter X	Latin	L&	(Miscellaneous)	_msc	Halfwidth and Fullwidth Forms
65426	2999	&#65426;	ﾒ	Halfwidth Katakana Letter Me	Katakana	Lo	(Miscellaneous)	_msc	Halfwidth and Fullwidth Forms
3	925	&#3;		<control>	Common	Cc	Latin	Latn	Basic Latin
177	4101	&plusmn;	±	Plus-minus Sign	Common	Sm	Latin	Latn	Latin-1 Supplement
235	21065	&euml;	ë	Latin Small Letter E With Diaeresis	Latin	L&	Latin	Latn	Latin-1 Supplement
293	15	&#293;	ĥ	Latin Small Letter H With Circumflex	Latin	L&	Latin	Latn	Latin Extended-A
351	42740	&#351;	ş	Latin Small Letter S With Cedilla	Latin	L&	Latin	Latn	Latin Extended-A
409	1	&#409;	ƙ	Latin Small Letter K With Hook	Latin	L&	Latin	Latn	Latin Extended-B
583	3	&#583;	ɇ	Latin Small Letter E With Stroke	Latin	L&	Latin	Latn	Latin Extended-B
641	10	&#641;	ʁ	Latin Letter Small Capital Inverted R	Latin	L&	(Phonetic)	_ipa	IPA Extensions
699	79	&#699;	ʻ	Modifier Letter Turned Comma	Common	Lm	(Symbols)	_sym	Spacing Modifier Letters
757	7	&#757;	˵	Modifier Letter Middle Double Grave Accent	Common	Sk	(Symbols)	_sym	Spacing Modifier Letters
815	159	&#815;	̯	Combining Inverted Breve Below	Inherited	Mn	(Diacriticals)	_dia	Combining Diacritical Marks
873	2	&#873;	ͩ	Combining Latin Small Letter D	Inherited	Mn	(Diacriticals)	_dia	Combining Diacritical Marks
931	13684	&Sigma;	Σ	Greek Capital Letter Sigma	Greek	L&	Greek	Grek	Greek and Coptic
989	2	&#989;	ϝ	Greek Small Letter Digamma	Greek	L&	Greek	Grek	Greek and Coptic
1047	6182	&#1047;	З	Cyrillic Capital Letter Ze	Cyrillic	L&	Cyrillic	Cyrl	Cyrillic
1105	10402	&#1105;	ё	Cyrillic Small Letter Io	Cyrillic	L&	Cyrillic	Cyrl	Cyrillic
